[
  {
    "ID": 7,
    "date": "22-02-2022",
    "time": "12:45",
    "student": {
      "ID": 5,
      "name": "Ivana",
      "surname": "Ivanovic",
      "numberOfIndex": "IT-44 2020",
      "adress": "Gogojeva 12",
      "city": "Novi Sad",
      "contact": "065/6477777",
      "studyProgram": {
        "ID": 1,
        "name": "Mehatronika",
        "duration": 4
      },
      "active": false
    },
    "employee": {
      "ID": 1,
      "name": "Valentina",
      "surname": "Andric",
      "counter": 6
    },
    "subject": {
      "ID": 1,
      "name": "Baze2",
      "professor": "Milos Milanovic",
      "espb": 5
    },
    "classroom": {
      "ID": 1,
      "numberOfClassroom": "ITC"
    }
  },
  {
    "ID": 8,
    "date": "22-02-2022",
    "time": "12:45",
    "student": {
      "ID": 5,
      "name": "Ivana",
      "surname": "Ivanovic",
      "numberOfIndex": "IT-44 2020",
      "adress": "Gogojeva 12",
      "city": "Novi Sad",
      "contact": "065/6477777",
      "studyProgram": {
        "ID": 1,
        "name": "Mehatronika",
        "duration": 4
      },
      "active": false
    },
    "employee": {
      "ID": 1,
      "name": "Valentina",
      "surname": "Andric",
      "counter": 6
    },
    "subject": {
      "ID": 1,
      "name": "Baze2",
      "professor": "Milos Milanovic",
      "espb": 5
    },
    "classroom": {
      "ID": 1,
      "numberOfClassroom": "ITC"
    }
  }
]
